{
  "harness_ref": "v0.0.1",
  "resolved_sha": "b4g5h6i7j8k9l0m1n2o3p4q5r6s7t8u9v0w1x2y3z4a5b6c7d8e9f0g1h2i3",
  "config_schema_version": "https://github.com/henrik-me/agent-harness/schemas/harness.config.schema.json",
  "synced_at": "2026-04-01T10:00:00Z",
  "files": [],
  "scaffolds": [],
  "excluded": []
}
